{
  "schemaVersion": "1.0.0",
  "runtimeVersion": "1.1.2",
  "generatedAt": "2026-09-12T16:40:36.517Z",
  "skills": [
    {
      "name": "agent-builder",
      "path": ".github/skills/agent-builder/SKILL.md",
      "description": "Build, validate, preview, and transactionally install least-privilege custom agents, including governed publication handoffs for Foundry endpoints, Microsoft 365 Copilot and Teams, or ChatGPT actions. Use when creating, updating, or reviewing .agent.md files; do not use for cloud deployment, channel publication, or MCP installation.",
      "lifecycle": "draft",
      "confidence": "low",
      "dependencies": [
        "clarify-the-ask",
        "policy-engine",
        "azure-discovery"
      ],
      "reports": [
        "reports/agent-builder-plan.json",
        "reports/agent-builder-plan.md",
        "reports/agent-builder-result.json",
        "reports/agent-blueprints/<id>.json"
      ],
      "sha256": "713e921c92951f9c99f992355a85ce70b77467cb99806dffdf845847ea618694",
      "audit": {
        "status": "passed",
        "checkedAt": "2026-09-12T16:40:36.434Z",
        "findings": []
      }
    },
    {
      "name": "architecture-review",
      "path": ".github/skills/architecture-review/SKILL.md",
      "description": "Assess a repository's designed architecture against reliability, security, cost, operational, and performance criteria using infrastructure-as-code, configuration, and decision records. Use for design-time review of the architecture a repository defines; use audit-azure-environment instead to assess a deployed cloud tenant.",
      "lifecycle": "draft",
      "confidence": "low",
      "dependencies": [
        "clarify-the-ask"
      ],
      "reports": [
        "reports/architecture-review.json",
        "reports/architecture-review.md"
      ],
      "sha256": "bdd150ac368c88621510d19970125460f8ed660f61c23a3423e1cf78e3e4ccb0",
      "audit": {
        "status": "passed",
        "checkedAt": "2026-09-12T16:40:36.435Z",
        "findings": []
      }
    },
    {
      "name": "artifact-upgrade",
      "path": ".github/skills/artifact-upgrade/SKILL.md",
      "description": "Plan and validate schema and artifact migrations with compatibility checks, backups, rollback routes, and migration evidence. Use when a schema or artifact version changes and existing records must migrate; use dependency-maintenance instead for application package upgrades.",
      "lifecycle": "draft",
      "confidence": "low",
      "dependencies": [
        "skill-inventory",
        "skill-dependency-manager"
      ],
      "reports": [
        "reports/artifact-upgrade-plan.json",
        "reports/artifact-upgrade-report.md"
      ],
      "sha256": "99c9c770951f5b31c003bb702f4399c966027b087faee7c95109f2a38b87763a",
      "audit": {
        "status": "passed",
        "checkedAt": "2026-09-12T16:40:36.435Z",
        "findings": []
      }
    },
    {
      "name": "audit-azure-environment",
      "path": ".github/skills/audit-azure-environment/SKILL.md",
      "description": "Perform an evidence-based, read-only Azure security, reliability, governance, cost, and configuration assessment. Use to assess a deployed tenant, subscription, or resource group; use architecture-review instead for design-time review of infrastructure code in the repository.",
      "lifecycle": "draft",
      "confidence": "low",
      "dependencies": [],
      "reports": [
        "reports/azure-audit-findings.json"
      ],
      "sha256": "f17456b4bd5279243a2ba1de17921b67a96dff430e4bdac09582f2ac97795a3d",
      "audit": {
        "status": "passed",
        "checkedAt": "2026-09-12T16:40:36.436Z",
        "findings": []
      }
    },
    {
      "name": "audit-code",
      "path": ".github/skills/audit-code/SKILL.md",
      "description": "Perform a complete, read-only repository audit for security, correctness, resource management, performance, dependencies, tests, architecture, and maintainability with structured evidence. Use for a whole-repository assessment; use change-review for a bounded diff and security-review for a security-only pass.",
      "lifecycle": "tested",
      "confidence": "medium",
      "dependencies": [],
      "reports": [
        "reports/code-audit-findings.json",
        "reports/gitleaks-scan.json",
        "reports/audit-evidence/*.json"
      ],
      "sha256": "99021c2ff23e89445fae390bd644ea71941d64780fdfa18a4d1791ad7850f2c7",
      "audit": {
        "status": "passed",
        "checkedAt": "2026-09-12T16:40:36.436Z",
        "findings": []
      }
    },
    {
      "name": "audit-plan-remediation",
      "path": ".github/skills/audit-plan-remediation/SKILL.md",
      "description": "Convert validated audit findings into prioritized remediation work with owners, dependencies, verification, rollout, and rollback guidance. Use after findings are reviewed and confirmed; do not use to generate findings or to execute the remediation work.",
      "lifecycle": "tested",
      "confidence": "medium",
      "dependencies": [
        "audit-review-findings",
        "policy-engine"
      ],
      "reports": [
        "reports/audit-remediation-plan.json",
        "reports/audit-remediation-plan.md"
      ],
      "sha256": "ece3c290d92fd7b404528266834bd61fd4c955e90be93b26dde1699f8421895d",
      "audit": {
        "status": "passed",
        "checkedAt": "2026-09-12T16:40:36.436Z",
        "findings": []
      }
    },
    {
      "name": "audit-remediation",
      "path": ".github/skills/audit-remediation/SKILL.md",
      "description": "Execute an approved audit remediation plan by all eligible phases, one phase, one finding, or resume state, with validation, rollback, checkpoints, and project handoff updates. Use only after audit-plan-remediation produces a valid plan; do not use to discover, review, or prioritize findings.",
      "lifecycle": "draft",
      "confidence": "low",
      "dependencies": [
        "audit-plan-remediation",
        "policy-engine",
        "workflow-state-manager",
        "workflow-recovery",
        "change-review",
        "systematic-debugging",
        "regression-test-development",
        "project-handoff",
        "audit-code"
      ],
      "reports": [
        "reports/audit-remediation-execution.json",
        "reports/audit-remediation-execution.md"
      ],
      "sha256": "0ebd2f5b53deb2233adf2c3d9f02228d54f35aa84cda698fa509fc964601171e",
      "audit": {
        "status": "passed",
        "checkedAt": "2026-09-12T16:40:36.436Z",
        "findings": []
      }
    },
    {
      "name": "audit-review-findings",
      "path": ".github/skills/audit-review-findings/SKILL.md",
      "description": "Transform structured audit findings into a traceable mixed-audience review while preserving IDs, severity, confidence, evidence, and limitations. Use between audit-code and remediation planning; do not use to discover new findings.",
      "lifecycle": "tested",
      "confidence": "medium",
      "dependencies": [
        "audit-code",
        "audit-azure-environment"
      ],
      "reports": [
        "reports/code-audit-review.json",
        "reports/code-audit-review.md",
        "reports/azure-audit-review.json",
        "reports/azure-audit-review.md"
      ],
      "sha256": "04345dd71c06014afb648983e2dedea50baec00a936e7c77de8173e4312f321b",
      "audit": {
        "status": "passed",
        "checkedAt": "2026-09-12T16:40:36.436Z",
        "findings": []
      }
    },
    {
      "name": "azure-cleanup",
      "path": ".github/skills/azure-cleanup/SKILL.md",
      "description": "Safely inspect and, after explicit confirmation, remove Azure resources associated with a project using resource-group, resource, or all-project cleanup scopes.",
      "lifecycle": "draft",
      "confidence": "low",
      "dependencies": [
        "azure-discovery",
        "project-handoff",
        "policy-engine"
      ],
      "reports": [
        "reports/azure-cleanup.json",
        "reports/azure-cleanup.md"
      ],
      "sha256": "1784cb21df5dda627e830ea8a54aed812dde03503d7df0a7474107006b1e05f8",
      "audit": {
        "status": "passed",
        "checkedAt": "2026-09-12T16:40:36.436Z",
        "findings": []
      }
    },
    {
      "name": "azure-discovery",
      "path": ".github/skills/azure-discovery/SKILL.md",
      "description": "Discover Azure Commercial or Azure US Government service and model availability for the current project, persist dated results, and identify when a refresh is needed.",
      "lifecycle": "tested",
      "confidence": "medium",
      "dependencies": [
        "project-handoff"
      ],
      "reports": [
        "reports/azure-discovery.json",
        "reports/azure-discovery.md"
      ],
      "sha256": "dceff0b3ef63deff1a4a24f95898c3f500325882a45075c11c92f3e1a56a2296",
      "audit": {
        "status": "passed",
        "checkedAt": "2026-09-12T16:40:36.436Z",
        "findings": []
      }
    },
    {
      "name": "change-review",
      "path": ".github/skills/change-review/SKILL.md",
      "description": "Review a bounded working-tree, commit, or pull-request diff for defects, security regressions, requirement gaps, and missing tests, with severity-ranked evidence. Use before commit or merge; use audit-code instead for repository-wide assessment.",
      "lifecycle": "draft",
      "confidence": "low",
      "dependencies": [
        "policy-engine"
      ],
      "reports": [
        "reports/change-review.json",
        "reports/change-review.md"
      ],
      "sha256": "32f726293f8638b915eccee74c923767628f3d97a8c9ebbc3932bda2c2e2b5ff",
      "audit": {
        "status": "passed",
        "checkedAt": "2026-09-12T16:40:36.436Z",
        "findings": []
      }
    },
    {
      "name": "ci-failure-triage",
      "path": ".github/skills/ci-failure-triage/SKILL.md",